Manual_Include,Updated_Entry_ID,Entry,Country,humantranslations,machinetranslations,Master_Tag,Entry_ID
N,P-540,"I don't use a pacifier, I use a revolver, a pistol","[""Brazil""]","[{""language"": ""Portuguese"", ""translation"": ""Não uso chupeta, uso revólver, pistola""}]","[{""language"": ""Chinese (Simplified)"", ""translation"": ""我不用奶嘴，我用左轮手枪，手枪""}, {""language"": ""Arabic"", ""translation"": ""أنا لا أستخدم مصاصة، أنا أستخدم مسدسًا، مسدسًا""}, {""language"": ""Spanish"", ""translation"": ""No uso un chupete, uso un revólver, una pistola""}, {""language"": ""German"", ""translation"": ""Ich benutze keinen Schnuller, ich benutze einen Revolver, eine Pistole""}, {""language"": ""Russian"", ""translation"": ""Я не пользуюсь пустышкой, я пользуюсь револьвером, пистолетом.""}, {""language"": ""Turkish"", ""translation"": ""Emzik kullanmıyorum, tabanca kullanıyorum.""}, {""language"": ""Portuguese"", ""translation"": ""Eu não uso chupeta, eu uso um revólver, uma pistola""}, {""language"": ""Chinese (Traditional)"", ""translation"": ""我不使用奶嘴，我使用左輪手槍，手槍""}, {""language"": ""Hindi"", ""translation"": ""मैं एक शांतकर्ता का उपयोग नहीं करता, मैं एक रिवॉल्वर, एक पिस्तौल का उपयोग करता हूं""}, {""language"": ""Persian (Farsi)"", ""translation"": ""من از پستانک استفاده نمی کنم ، از یک گردان ، یک تپانچه استفاده می کنم""}, {""language"": ""Afrikaans"", ""translation"": ""Ek gebruik nie 'n fopspeen nie, ek gebruik 'n rewolwer, 'n pistool""}, {""language"": ""Zulu"", ""translation"": ""Angisebenzisi i-pacifier, ngisebenzisa i-revolver, isibhamu""}]",politics,[24]
N,P-541,"When a PT supporter isn't stealing, he's lying","[""Brazil""]","[{""language"": ""Portuguese"", ""translation"": ""Petista quando não está roubando, está mentindo""}]","[{""language"": ""Chinese (Simplified)"", ""translation"": ""当 PT 支持者不偷窃时，他在撒谎""}, {""language"": ""Arabic"", ""translation"": ""عندما لا يقوم مؤيد حزب العمال بالسرقة، فهو يكذب""}, {""language"": ""Spanish"", ""translation"": ""Cuando un simpatizante del PT no está robando, está mintiendo""}, {""language"": ""German"", ""translation"": ""Wenn ein PT-Anhänger nicht stiehlt, lügt er""}, {""language"": ""Russian"", ""translation"": ""Когда сторонник PT не ворует, он лжет""}, {""language"": ""Turkish"", ""translation"": ""Bir PT destekçisi çalmıyorsa, yalan söylüyordur""}, {""language"": ""Portuguese"", ""translation"": ""Quando um apoiador do PT não está roubando, ele está mentindo""}, {""language"": ""Chinese (Traditional)"", ""translation"": ""當PT支持者不偷竊時，他在撒謊""}, {""language"": ""Hindi"", ""translation"": ""जब एक पीटी समर्थक चोरी नहीं कर रहा है, तो वह झूठ बोल रहा है""}, {""language"": ""Persian (Farsi)"", ""translation"": ""وقتی یک حامی PT در حال سرقت نیست ، دروغ می گوید""}, {""language"": ""Afrikaans"", ""translation"": ""As 'n PT -ondersteuner nie steel nie, lieg hy""}, {""language"": ""Zulu"", ""translation"": ""Lapho umsekeli we-PT engebi, uqamba amanga""}]",politics,[25]
N,P-542,Where are the R$16.5 million that your father stole from Arabia?,"[""Brazil""]","[{""language"": ""Portuguese"", ""translation"": ""Onde é que estão os R$ 16,5 milhões que o seu pai roubou lá da Arábia?""}]","[{""language"": ""Chinese (Simplified)"", ""translation"": ""你父亲从阿拉伯偷走的 1650 万雷亚尔在哪里？""}, {""language"": ""Arabic"", ""translation"": ""أين هي ال 16.5 مليون ريال برازيلي التي سرقها والدك من الجزيرة العربية؟""}, {""language"": ""Spanish"", ""translation"": ""¿Dónde están los 16,5 millones de reales que tu padre robó a Arabia?""}, {""language"": ""German"", ""translation"": ""Wo sind die 16,5 Millionen R$, die Ihr Vater aus Arabien gestohlen hat?""}, {""language"": ""Russian"", ""translation"": ""Где 16,5 миллионов реалов, которые ваш отец украл у Аравии?""}, {""language"": ""Turkish"", ""translation"": ""Babanızın Arabistan'dan çaldığı 16,5 milyon R$ nerede?""}, {""language"": ""Portuguese"", ""translation"": ""Onde estão os R$ 16,5 milhões que seu pai roubou da Arábia?""}, {""language"": ""Chinese (Traditional)"", ""translation"": ""您父親從阿拉伯偷走的1650萬雷亞爾在哪裡？""}, {""language"": ""Hindi"", ""translation"": ""आर $ 16.5 मिलियन कहां हैं जो आपके पिता ने अरब से चुराए हैं?""}, {""language"": ""Persian (Farsi)"", ""translation"": ""16.5 میلیون دلار R که پدرتان از عربستان دزدیدند کجا هستند؟""}, {""language"": ""Afrikaans"", ""translation"": ""Waar is die R $ 16,5 miljoen wat u pa uit Arabië gesteel het?""}, {""language"": ""Zulu"", ""translation"": ""Baphi u-R $ 16,5 million owabiwa ubaba wakho e-Arabia?""}]",politics,[26]
N,P-543,"Taking your weight into account, by taking the vaccine you'll be indirectly saving about 300 people who won't get the shot and won't be guinea pigs","[""Brazil""]","[{""language"": ""Portuguese"", ""translation"": ""Levando em conta seu peso, voce tomando a vacina estará salvando indiretamente umas 300 pessoas que ficarão sem a aplicação e não serão cobaias""}]","[{""language"": ""Chinese (Simplified)"", ""translation"": ""考虑到您的体重，接种疫苗后，您将间接拯救约 300 人，他们不会接种疫苗，也不会成为小白鼠。""}, {""language"": ""Arabic"", ""translation"": ""مع أخذ وزنك في الحسبان، فإنك بأخذك اللقاح ستنقذ بشكل غير مباشر حوالي 300 شخص لن يحصلوا على اللقاح ولن يكونوا خنازير غينيا""}, {""language"": ""Spanish"", ""translation"": ""Teniendo en cuenta tu peso, al vacunarte estarás salvando indirectamente a unas 300 personas que no se vacunarán y no serán conejillos de indias""}, {""language"": ""German"", ""translation"": ""Wenn man Ihr Gewicht berücksichtigt, retten Sie mit der Impfung indirekt etwa 300 Menschen, die nicht geimpft werden und nicht als Versuchskaninchen herhalten müssen.""}, {""language"": ""Russian"", ""translation"": ""Учитывая ваш вес, принимая вакцину, вы косвенно спасете около 300 человек, которые не получат прививку и не станут подопытными кроликами.""}, {""language"": ""Turkish"", ""translation"": ""Kilonuzu hesaba katarsak, aşı yaptırarak dolaylı olarak aşı yaptırmayacak ve kobay olmayacak yaklaşık 300 kişiyi kurtarmış olacaksınız""}, {""language"": ""Portuguese"", ""translation"": ""Levando em conta seu peso, ao tomar a vacina, você estará salvando indiretamente cerca de 300 pessoas que não tomarão a vacina e não serão cobaias""}, {""language"": ""Chinese (Traditional)"", ""translation"": ""考慮到您的體重，通過服用疫苗，您將間接節省大約300人不會射擊而不會是豚鼠""}, {""language"": ""Hindi"", ""translation"": ""अपने वजन को ध्यान में रखते हुए, वैक्सीन लेने से आप अप्रत्यक्ष रूप से लगभग 300 लोगों को बचा लेंगे, जिन्हें शॉट नहीं मिलेगा और गिनी सूअर नहीं होंगे""}, {""language"": ""Persian (Farsi)"", ""translation"": ""با در نظر گرفتن وزن خود ، با گرفتن واکسن به طور غیرمستقیم حدود 300 نفر را که شلیک نمی کنند صرفه جویی می کنید و خوکچه هندی نخواهند بود""}, {""language"": ""Afrikaans"", ""translation"": ""As u u gewig in ag neem, bespaar u indirek ongeveer 300 mense wat nie die skoot sal kry nie en sal nie proefkonyn wees nie""}, {""language"": ""Zulu"", ""translation"": ""Ukuthatha isisindo sakho, ngokuthatha umuthi wokugoma uzobe ulondoloze ngokungaqondile kubantu abangama-300 abangakwazi ukuthola i-shot futhi ngeke babe izingulube ze-Guinea""}]",politics,[27]
N,P-544,You don't deserve to be raped because you're so ugly,"[""Brazil""]","[{""language"": ""Portuguese"", ""translation"": ""não merece ser estuprada porque é muito feia""}]","[{""language"": ""Chinese (Simplified)"", ""translation"": ""你不配被强奸，因为你太丑了""}, {""language"": ""Arabic"", ""translation"": ""أنت لا تستحقين أن يتم اغتصابك لأنك قبيحة جداً""}, {""language"": ""Spanish"", ""translation"": ""No mereces ser violada porque eres muy fea.""}, {""language"": ""German"", ""translation"": ""Du verdienst es nicht, vergewaltigt zu werden, weil du so hässlich bist.""}, {""language"": ""Russian"", ""translation"": ""Ты не заслуживаешь того, чтобы тебя изнасиловали, потому что ты такая уродливая.""}, {""language"": ""Turkish"", ""translation"": ""Çok çirkin olduğun için tecavüze uğramayı hak etmiyorsun.""}, {""language"": ""Portuguese"", ""translation"": ""Você não merece ser estuprada porque é muito feia""}, {""language"": ""Chinese (Traditional)"", ""translation"": ""你不應該被強姦，因為你這麼醜""}, {""language"": ""Hindi"", ""translation"": ""आप बलात्कार के लायक नहीं हैं क्योंकि आप बहुत बदसूरत हैं""}, {""language"": ""Persian (Farsi)"", ""translation"": ""شما سزاوار تجاوز نیستید زیرا خیلی زشت هستید""}, {""language"": ""Afrikaans"", ""translation"": ""Jy verdien nie om verkrag te word nie, want jy is so lelik""}, {""language"": ""Zulu"", ""translation"": ""Awukufanele ukudlwengulwa ngoba mubi kakhulu""}]",politics,[28]
